{
  "schema_version": "0.1.0",
  "id": "bare-driver",
  "version": "1.0.0",
  "description": "Full harness with the candidate native interface and vendor guidance removed.",
  "harness": {
    "kind": "full",
    "inventory": {
      "path": "freeze-inputs/harness-full.json",
      "sha256": "82f7210b8078069a55c3a6aec178931c8fcbc3785e981ad59c26d690b894f9ef"
    }
  },
  "driver_presentation": "candidate-native",
  "guidance": { "mode": "removed" },
  "decision_bearing": true
}
